<?xml version="1.0" encoding="UTF-8"?>
<dataroot xmlns:od="urn:schemas-microsoft-com:officedata" xmlns:xsi="http://www.w3.org/2001/XMLSchema-instance"  xsi:noNamespaceSchemaLocation="91_Informant.xsd" generated="2025-07-15T15:45:48">
<_x0039_1_Informant>
<InformantID>1</InformantID>
<Informant>Youth</Informant>
<InformantType>1</InformantType>
</_x0039_1_Informant>
<_x0039_1_Informant>
<InformantID>2</InformantID>
<Informant>Caregiver</Informant>
<InformantType>2</InformantType>
</_x0039_1_Informant>
<_x0039_1_Informant>
<InformantID>3</InformantID>
<Informant>Teacher</Informant>
<InformantType>2</InformantType>
</_x0039_1_Informant>
<_x0039_1_Informant>
<InformantID>4</InformantID>
<Informant>Adult</Informant>
<InformantType>1</InformantType>
</_x0039_1_Informant>
<_x0039_1_Informant>
<InformantID>5</InformantID>
<Informant>Therapist</Informant>
<InformantType>2</InformantType>
</_x0039_1_Informant>
</dataroot>
